16:59:36.718598 IP w-159-107.wfer.ens-paris-saclay.fr.mdns > 224.0.0.251.mdns: 0 [39a] [4q] [1au] PTR (QM)? _companion-link._tcp.local. PTR (QM)? _homekit._tcp.local. PTR (QM)? _sleep-proxy._udp.local. TXT (QU)? MacBook gf._companion-link._tcp.local. (1403)
16:59:36.718814 IP w-152-165.wfer.ens-paris-saclay.fr.mdns > 224.0.0.251.mdns: 0*- [0q] 1/0/0 (Cache flush) A 138.231.152.165 (49)
16:59:36.719044 IP w-152-165.wfer.ens-paris-saclay.fr.mdns > 224.0.0.251.mdns: 0*- [0q] 1/0/0 (Cache flush) A 138.231.152.165 (49)
16:59:36.719380 IP w-151-6.wfer.ens-paris-saclay.fr.mdns > 224.0.0.251.mdns: 0 [3q] [1au] TXT (QU)? iPad de Malo._companion-link._tcp.local. TXT (QU)? Wei de iPad._companion-link._tcp.local. TXT (QU)? iPad de Anissa._companion-link._tcp.local. (125)
16:59:36.719731 IP w-149-43.wfer.ens-paris-saclay.fr.mdns > 224.0.0.251.mdns: 0*- [0q] 2/0/0 TXT "model=MacBookPro12,1" "osxvers=21", PTR port-mguillard._companion-link._tcp.local. (139)
16:59:36.719998 IP w-151-210.wfer.ens-paris-saclay.fr.mdns > 224.0.0.251.mdns: 0*- [0q] 1/0/0 PTR MacBook Pro de martin._companion-link._tcp.local. (74)
16:59:36.720654 IP w-147-173.wfer.ens-paris-saclay.fr.mdns > 224.0.0.251.mdns: 0*- [0q] 2/0/6 PTR SuperKick._companion-link._tcp.local., TXT "model=MacBookPro15,2" "osxvers=20" "ecolor=225,225,223" (366)
16:59:36.722284 IP w-151-245.wfer.ens-paris-saclay.fr.51470 > 239.255.255.250.ws-discovery: UDP, length 1084
16:59:36.722624 IP w-158-180.wfer.ens-paris-saclay.fr.mdns > 224.0.0.251.mdns: 0*- [0q] 2/0/1 PTR RoccoM-bM-^@M-^Ys MacBook Air._companion-link._tcp.local., (Cache flush) TXT "rpBA=C9:16:C5:00:65:99" "rpVr=152.1" (141)
16:59:36.722995 IP w-146-47.wfer.ens-paris-saclay.fr.mdns > 224.0.0.251.mdns: 0*- [0q] 2/0/0 TXT "model=MacBookPro11,3" "osxvers=20", PTR MacBookPro-FTreussart._companion-link._tcp.local. (153)
16:59:36.723226 IP w-154-251.wfer.ens-paris-saclay.fr.mdns > 224.0.0.251.mdns: 0*- [0q] 1/0/0 (Cache flush) A 138.231.154.251 (49)
16:59:36.723445 IP w-151-245.wfer.ens-paris-saclay.fr.mdns > 224.0.0.251.mdns: 0 ANY (QM)? DESKTOP-EBHMJBI.local. (39)
16:59:36.723657 IP w-151-245.wfer.ens-paris-saclay.fr.50580 > 224.0.0.252.llmnr: UDP, length 33
16:59:36.723887 IP w-154-251.wfer.ens-paris-saclay.fr.mdns > 224.0.0.251.mdns: 0*- [0q] 1/0/0 (Cache flush) A 138.231.154.251 (49)
16:59:36.724119 IP w-154-251.wfer.ens-paris-saclay.fr.mdns > 224.0.0.251.mdns: 0*- [0q] 1/0/0 (Cache flush) A 138.231.154.251 (49)
16:59:36.724351 IP w-152-165.wfer.ens-paris-saclay.fr.mdns > 224.0.0.251.mdns: 0*- [0q] 1/0/0 (Cache flush) A 138.231.152.165 (49)
16:59:36.726474 IP w-145-61.wfer.ens-paris-saclay.fr.53458 > 239.83.100.109.33355: UDP, length 1464
16:59:36.727003 IP w-145-61.wfer.ens-paris-saclay.fr.53458 > 239.83.100.109.33355: UDP, length 275
16:59:36.727395 IP w-148-68.wfer.ens-paris-saclay.fr.58269 > 239.255.255.250.ssdp: UDP, length 174
16:59:36.727626 IP w-145-30.wfer.ens-paris-saclay.fr.mdns > 224.0.0.251.mdns: 0*- [0q] 1/0/0 (Cache flush) A 138.231.145.30 (48)
16:59:36.819459 IP w-146-55.wfer.ens-paris-saclay.fr.54915 > 138.231.159.255.54915: UDP, length 263
16:59:36.819683 IP w-145-30.wfer.ens-paris-saclay.fr.mdns > 224.0.0.251.mdns: 0*- [0q] 1/0/0 (Cache flush) A 138.231.145.30 (48)
16:59:36.819972 IP w-155-65.wfer.ens-paris-saclay.fr.mdns > 224.0.0.251.mdns: 0 [1au] TXT (QU)? MacBook Air de Isabelle._companion-link._tcp.local. (97)
16:59:36.820209 IP w-145-30.wfer.ens-paris-saclay.fr.mdns > 224.0.0.251.mdns: 0*- [0q] 1/0/0 (Cache flush) A 138.231.145.30 (48)
16:59:36.820761 IP w-154-16.wfer.ens-paris-saclay.fr.db-lsp-disc > 138.231.159.255.db-lsp-disc: UDP, length 293
16:59:36.821112 IP w-158-114.wfer.ens-paris-saclay.fr.mdns > 224.0.0.251.mdns: 0*- [0q] 1/0/1 (Cache flush) TXT "rpBA=74:C5:1B:25:0C:D3" "rpVr=152.1" (132)
16:59:36.821346 IP w-147-119.wfer.ens-paris-saclay.fr.netbios-ns > 138.231.159.255.netbios-ns: UDP, length 50
16:59:36.821569 IP w-157-123.wfer.ens-paris-saclay.fr.mdns > 224.0.0.251.mdns: 0 PTR (QU)? _sleep-proxy._udp.local. (41)
16:59:36.821968 IP w-145-248.wfer.ens-paris-saclay.fr.54030 > 239.255.255.250.ssdp: UDP, length 173
16:59:36.822406 IP w-155-103.wfer.ens-paris-saclay.fr.mdns > 224.0.0.251.mdns: 0*- [0q] 1/0/1 (Cache flush) TXT "rpHN=3c4882b3bac0" "rpFl=0x30000" "rpVr=195.2" "rpHA=7b2421d7c399" "rpAD=0665b0a0366d" "rpHI=04527422b459" "rpBA=09:66:5F:9A:0C:5C" (205)
16:59:36.822970 IP w-150-16.wfer.ens-paris-saclay.fr.mdns > 224.0.0.251.mdns: 0 [9q] [1au] PTR (QM)? lb._dns-sd._udp.local. PTR (QM)? _homekit._tcp.local. TXT (QM)? MacBook Air de Pauline (2)._companion-link._tcp.local. TXT (QU)? MacBook Air de Isabelle._companion-link._tcp.local. TXT (QU)? MacBook di Federica._companion-link._tcp.local. TXT (QU)? Susannes MacBook Pro._companion-link._tcp.local. TXT (QU)? MacBook Pro de Issam._companion-link._tcp.local. TXT (QU)? port-mguillard._companion-link._tcp.local. TXT (QU)? MacBookPro-FTreussart._companion-link._tcp.local. (296)
16:59:36.823305 IP w-146-122.wfer.ens-paris-saclay.fr.42441 > 239.255.255.250.ssdp: UDP, length 125
16:59:36.823703 IP w-151-6.wfer.ens-paris-saclay.fr.mdns > 224.0.0.251.mdns: 0 [4q] [1au] TXT (QU)? MacBook Air de Isabelle._companion-link._tcp.local. TXT (QU)? MacBook Pro de Issam._companion-link._tcp.local. TXT (QU)? port-mguillard._companion-link._tcp.local. TXT (QU)? MacBookPro-FTreussart._companion-link._tcp.local. (173)
16:59:36.825784 IP w-150-16.wfer.ens-paris-saclay.fr.mdns > 224.0.0.251.mdns: 0 [b2&3=0x200] [41a] [1au] PTR (QM)? _companion-link._tcp.local. (1437)
16:59:36.826251 IP w-150-16.wfer.ens-paris-saclay.fr.mdns > 224.0.0.251.mdns: 0 [5a] [0q] [1au] (228)
16:59:36.922235 IP w-148-140.wfer.ens-paris-saclay.fr.mdns > 224.0.0.251.mdns: 0 [15a] [4q] PTR (QU)? _afpovertcp._tcp.local. PTR (QU)? _smb._tcp.local. PTR (QU)? _rfb._tcp.local. PTR (QU)? _adisk._tcp.local. (538)
16:59:36.922804 IP w-147-23.wfer.ens-paris-saclay.fr.mdns > 224.0.0.251.mdns: 0*- [0q] 2/0/6 PTR MacBook Pro (5)._companion-link._tcp.local., TXT "model=MacBookPro11,5" "osxvers=17" (306)
16:59:36.923255 IP w-145-139.wfer.ens-paris-saclay.fr.mdns > 224.0.0.251.mdns: 0*- [0q] 1/0/1 (Cache flush) TXT "rpMac=0" "rpHN=fe6b74246750" "rpFl=0x30000" "rpHA=de7f88389cd0" "rpVr=310.7.1" "rpAD=2ff528f5fa2e" "rpHI=6a7b9ac62642" "rpBA=06:A4:B3:36:C7:7D" (212)
16:59:36.923702 IP w-158-240.wfer.ens-paris-saclay.fr.mdns > 224.0.0.251.mdns: 0*- [0q] 1/0/1 (Cache flush) TXT "rpMac=0" "rpHN=8309ad871320" "rpFl=0x30000" "rpHA=34f8458a526e" "rpVr=230.1" "rpAD=ab1a1de34a58" "rpHI=7b8da081f3d2" "rpBA=31:AB:43:0B:D3:43" (211)
16:59:36.923998 IP w-155-65.wfer.ens-paris-saclay.fr.mdns > 224.0.0.251.mdns: 0 [1au] TXT (QU)? MacBookPro-FTreussart._companion-link._tcp.local. (95)
16:59:36.925040 IP w-157-222.wfer.ens-paris-saclay.fr.54009 > 239.255.255.250.ws-discovery: UDP, length 656
16:59:36.925440 IP w-154-238.wfer.ens-paris-saclay.fr.62007 > 239.255.255.250.ssdp: UDP, length 174
16:59:36.926478 IP w-149-112.wfer.ens-paris-saclay.fr.mdns > 224.0.0.251.mdns: 0*- [0q] 8/0/4 (Cache flush) TXT "am=AppleTV3,2" "ch=2" "cn=1,3" "da=true" "et=0,3,5" "ft=0x5E7FFFF7,0x1E" "md=0,1,2" "tp=UDP" "vn=65537" "vs=220.00" "vv=2" "sf=0x4" "pk=8fc4180d141ff89ff9d5db78f0c0246881b2de9a617a8bc78f9a9642353d5feb", PTR _raop._tcp.local., PTR 3448ED07395E@DESKTOP-AUBIN._raop._tcp.local., (Cache flush) TXT "deviceid=34:48:ED:07:39:5E" "features=0x5E7FFFF7,0x1E" "model=AppleTV3,2" "srcvers=220.00" "vv=2" "flags=0x4" "pk=8fc4180d141ff89ff9d5db78f0c0246881b2de9a617a8bc78f9a9642353d5feb", PTR _airplay._tcp.local., PTR DESKTOP-AUBIN._airplay._tcp.local., (Cache flush) SRV DESKTOP-AUBIN.local.:47000 0 0, (Cache flush) SRV DESKTOP-AUBIN.local.:47000 0 0 (654)
16:59:37.024096 IP w-149-43.wfer.ens-paris-saclay.fr.mdns > 224.0.0.251.mdns: 0*- [0q] 1/0/1 (Cache flush) TXT "rpBA=3E:08:5D:4F:BC:72" "rpAD=e573150b4d6e" "rpFl=0x20000" "rpHN=7a2e5f5acae6" "rpMac=0" "rpVr=310.7.1" (179)
16:59:37.024432 IP w-149-192.wfer.ens-paris-saclay.fr.58971 > 239.255.255.250.ssdp: UDP, length 126
16:59:37.025189 IP w-157-250.wfer.ens-paris-saclay.fr.mdns > 224.0.0.251.mdns: 0*- [0q] 2/0/6 PTR MacBook Air de Kosiachevskyi._companion-link._tcp.local., TXT "model=MacBookAir7,2" "osxvers=21" (441)
16:59:37.025581 IP w-151-4.wfer.ens-paris-saclay.fr.mdns > 224.0.0.251.mdns: 0*- [0q] 2/0/0 PTR MacBook Pro de Karine._companion-link._tcp.local., TXT "model=MacBookPro15,2" "osxvers=20" "ecolor=157,157,160" (172)
16:59:37.027521 IP w-157-241.wfer.ens-paris-saclay.fr.mdns > 224.0.0.251.mdns: 0 [51q] [1au] PTR (QU)? _companion-link._tcp.local. PTR (QU)? _homekit._tcp.local. TXT (QU)? iPad de Patricia._companion-link._tcp.local. TXT (QU)? MacBook de Agathe._companion-link._tcp.local. TXT (QU)? RoccoM-bM-^@M-^Ys MacBook Air._companion-link._tcp.local. TXT (QU)? Susannes MacBook Pro._companion-link._tcp.local. TXT (QU)? MacBook Air de Mihaja._companion-link._tcp.local. TXT (QU)? MacBook gf._companion-link._tcp.local. TXT (QU)? JuanM-bM-^@M-^Ys MacBook Pro._companion-link._tcp.local. TXT (QU)? iPad de Malo._companion-link._tcp.local. TXT (QU)? PamelaM-bM-^@M-^Ys MacBook Pro._companion-link._tcp.local. TXT (QU)? MacBook Air de Ngoc Diep Lai._companion-link._tcp.local. TXT (QU)? MARS-07._companion-link._tcp.local. TXT (QU)? MacBook Air de Isabelle._companion-link._tcp.local. TXT (QU)? MacBook Air cM-aM-;M-'a Do._companion-link._tcp.local. TXT (QU)? MacBook Air (5)._companion-link._tcp.local. TXT (QU)? MacBook Pro de martin._companion-link._tcp.local. TXT (QU)? MacBook Pro de Karine._companion-link._tcp.local. TXT (QU)? MacBook Pro de Benedikt._companion-link._tcp.local. TXT (QU)? MacBookPro-FTreussart._companion-link._tcp.local. TXT (QU)? Wei de iPad._companion-link._tcp.local. TXT (QU)? maconeM-bM-^@M-^Ys MacBook Pro (2)._companion-link._tcp.local. TXT (QU)? PAB Macbook Pro._companion-link._tcp.local. TXT (QU)? MacBook Pro de Zhou._companion-link._tcp.local. TXT (QU)? MacBook Pro de Issam._companion-link._tcp.local. TXT (QU)? MacBook Air de Kosiachevskyi._companion-link._tcp.local. TXT (QU)? MacBook Cedric._companion-link._tcp.local. TXT (QU)? MacBook Pro (5)._companion-link._tcp.local. TXT (QU)? MacBook Air de Pauline (2)._companion-link._tcp.local. TXT (QU)? iPad (3)._companion-link._tcp.local. TXT (QU)? MacBook Air de Dupin._companion-link._tcp.local. TXT (QU)? El pro._companion-link._tcp.local. TXT (QU)? MacBook Air de SM-CM-)bastien._companion-link._tcp.local. TXT (QU)? MacBook Air de Bryan._companion-link._tcp.local. TXT (QU)? mbk-11-53 (2)._companion-link._tcp.local. TXT (QU)? MathiasM-bM-^@M-^Ys MacBook Pro._companion-link._tcp.local. TXT (QU)? iPad Pro de Rafael._companion-link._tcp.local. TXT (QU)? MacBook Air de Anna._companion-link._tcp.local. TXT (QU)? iPad de Anissa._companion-link._tcp.local. TXT (QU)? MacBook de Baptiste._companion-link._tcp.local. TXT (QU)? xuyangM-bM-^@M-^Ys MacBook Pro._companion-link._tcp.local. TXT (QU)? SuperKick._companion-link._tcp.local. TXT (QU)? Ambre._companion-link._tcp.local. TXT (QU)? MacBook Pro de Myriam (2)._companion-link._tcp.local. TXT (QU)? port-mguillard._companion-link._tcp.local. TXT (QU)? MacBook Pro de Karim._companion-link._tcp.local. TXT (QU)? MacBook Pro CDS (2)._companion-link._tcp.local. TXT (QU)? MacBook Pro de MM-CM-)lanie._companion-link._tcp.local. TXT (QU)? MacBook Air de Perrot._companion-link._tcp.local. TXT (QU)? MacBook di Federica._companion-link._tcp.local. TXT (QU)? MacBook Pro de delelis._companion-link._tcp.local. (1327)
16:59:37.028035 IP w-153-255.wfer.ens-paris-saclay.fr.54915 > 138.231.159.255.54915: UDP, length 263
16:59:37.028318 IP w-153-120.wfer.ens-paris-saclay.fr.mdns > 224.0.0.251.mdns: 0 [2q] [1au] TXT (QU)? MacBook Pro de Issam._companion-link._tcp.local. TXT (QU)? port-mguillard._companion-link._tcp.local. (115)
16:59:37.028728 IP w-152-198.wfer.ens-paris-saclay.fr.mdns > 224.0.0.251.mdns: 0*- [0q] 1/0/1 (Cache flush) TXT "rpBA=4E:FC:79:B7:31:F9" "rpAD=9277bf659f82" "rpFl=0x20000" "rpHN=d3acfb85aa72" "rpMac=0" "rpVr=250.5" (183)
16:59:37.126540 IP w-145-123.wfer.ens-paris-saclay.fr.mdns > 224.0.0.251.mdns: 0*- [0q] 1/0/1 (Cache flush) TXT "rpMac=0" "rpHN=3874874d94b4" "rpFl=0x20000" "rpHA=d4f16b0c434d" "rpVr=310.7.1" "rpAD=0a18bc39902c" "rpHI=b6ac44f2ea98" "rpBA=2E:C7:B3:BD:18:0C" (224)
16:59:37.126909 IP w-158-119.wfer.ens-paris-saclay.fr.netbios-ns > 138.231.159.255.netbios-ns: UDP, length 50
16:59:37.127009 IP w-158-119.wfer.ens-paris-saclay.fr.netbios-ns > 138.231.159.255.netbios-ns: UDP, length 50
16:59:37.127701 IP w-151-211.wfer.ens-paris-saclay.fr.mdns > 224.0.0.251.mdns: 0*- [0q] 2/0/6 PTR MacBook Air de Mihaja._companion-link._tcp.local., TXT "model=MacBookAir8,2" "osxvers=19" "ecolor=225,225,223" (393)
16:59:37.127936 IP w-158-119.wfer.ens-paris-saclay.fr.netbios-ns > 138.231.159.255.netbios-ns: UDP, length 50
16:59:37.128459 IP w-147-201.wfer.ens-paris-saclay.fr.mdns > 224.0.0.251.mdns: 0 [3a] [6q] [1au] PTR (QU)? _companion-link._tcp.local. PTR (QU)? _homekit._tcp.local. PTR (QU)? _sleep-proxy._udp.local. TXT (QU)? DESKTOP-AUBIN._airplay._tcp.local. TXT (QU)? MacBook Air de Kosiachevskyi._companion-link._tcp.local. TXT (QU)? MacBook Pro de Karine._companion-link._tcp.local. (268)
16:59:37.128790 IP w-157-241.wfer.ens-paris-saclay.fr.mdns > 224.0.0.251.mdns: 0 [2q] [1au] TXT (QU)? MacBook Pro de Karine._companion-link._tcp.local. TXT (QU)? MacBook Pro de Karim._companion-link._tcp.local. (122)
16:59:37.129797 IP w-157-222.wfer.ens-paris-saclay.fr.54009 > 239.255.255.250.ws-discovery: UDP, length 656
16:59:37.130131 IP w-146-122.wfer.ens-paris-saclay.fr.42441 > 239.255.255.250.ssdp: UDP, length 125
16:59:37.130537 IP w-148-105.wfer.ens-paris-saclay.fr.mdns > 224.0.0.251.mdns: 0*- [0q] 2/0/0 PTR MacBook Pro de Myriam (2)._companion-link._tcp.local., TXT "model=MacBookPro15,4" "osxvers=20" "ecolor=157,157,160" (180)
16:59:37.132658 IP w-153-46.wfer.ens-paris-saclay.fr.mdns > 224.0.0.251.mdns: 0 [b2&3=0x200] [41a] [1au] PTR (QM)? _companion-link._tcp.local. (1434)
16:59:37.133269 IP w-153-46.wfer.ens-paris-saclay.fr.mdns > 224.0.0.251.mdns: 0 [8a] [0q] [1au] (337)
16:59:37.133555 IP w-153-46.wfer.ens-paris-saclay.fr.mdns > 224.0.0.251.mdns: 0 [2q] [1au] PTR (QM)? _homekit._tcp.local. PTR (QM)? _sleep-proxy._udp.local. (90)
16:59:37.134283 IP w-156-250.wfer.ens-paris-saclay.fr.mdns > 224.0.0.251.mdns: 0*- [0q] 2/0/6 PTR MacBook Pro de MM-CM-)lanie._companion-link._tcp.local., TXT "model=MacBookPro12,1" "osxvers=19" (419)
16:59:37.134510 IP w-152-221.wfer.ens-paris-saclay.fr.mdns > 224.0.0.251.mdns: 0 PTR (QM)? _spotify-connect._tcp.local. (45)
16:59:37.134713 IP w-154-251.wfer.ens-paris-saclay.fr.mdns > 224.0.0.251.mdns: 0 A (QM)? wpad.local. (28)
16:59:37.134909 IP w-154-251.wfer.ens-paris-saclay.fr.58313 > 224.0.0.252.llmnr: UDP, length 22
16:59:37.135347 IP w-147-118.wfer.ens-paris-saclay.fr.mdns > 224.0.0.251.mdns: 0 [2a] [5q] [1au] PTR (QU)? _companion-link._tcp.local. PTR (QU)? _homekit._tcp.local. PTR (QU)? _sleep-proxy._udp.local. TXT (QU)? MacBook Air de Kosiachevskyi._companion-link._tcp.local. TXT (QU)? MacBook Pro de Karine._companion-link._tcp.local. (203)
16:59:37.135834 IP w-146-28.wfer.ens-paris-saclay.fr.mdns > 224.0.0.251.mdns: 0*- [0q] 3/0/1 TXT "model=MacBookPro16,2" "osxvers=19" "ecolor=157,157,160", (Cache flush) TXT "rpBA=DB:10:A7:F4:86:4B" "rpAD=fb97aaffc1db" "rpFl=0x20000" "rpHN=9625d978ec41" "rpVr=195.2", PTR MacBook gf._companion-link._tcp.local. (266)
16:59:37.137710 IP w-151-6.wfer.ens-paris-saclay.fr.mdns > 224.0.0.251.mdns: 0 [36a] [2q] [1au] PTR (QM)? _companion-link._tcp.local. TXT (QU)? MacBook Pro de Karine._companion-link._tcp.local. (1280)
16:59:37.229084 IP w-146-149.wfer.ens-paris-saclay.fr.mdns > 224.0.0.251.mdns: 0*- [0q] 2/0/7 PTR MacBook Pro de delelis._companion-link._tcp.local., TXT "model=MacBookPro11,4" "osxvers=17" (352)
16:59:37.229511 IP w-159-41.wfer.ens-paris-saclay.fr.netbios-dgm > 138.231.159.255.netbios-dgm: UDP, length 194
16:59:37.230026 IP w-148-68.wfer.ens-paris-saclay.fr.mdns > 224.0.0.251.mdns: 0*- [0q] 3/0/1 TXT "model=MacBook8,1" "osxvers=20" "ecolor=157,157,160", (Cache flush) TXT "rpBA=3F:0A:B1:52:C0:6B" "rpAD=533bbc1eb54b" "rpFl=0x20000" "rpHN=3d9c2601a159" "rpMac=0" "rpVr=230.1", PTR MacBook di Federica._companion-link._tcp.local. (288)
16:59:37.230320 IP w-155-65.wfer.ens-paris-saclay.fr.mdns > 224.0.0.251.mdns: 0 [1au] TXT (QU)? MacBook Pro de Karine._companion-link._tcp.local. (95)
16:59:37.230675 IP w-158-180.wfer.ens-paris-saclay.fr.mdns > 224.0.0.251.mdns: 0*- [0q] 2/0/1 PTR RoccoM-bM-^@M-^Ys MacBook Air._companion-link._tcp.local., (Cache flush) TXT "rpBA=C9:16:C5:00:65:99" "rpVr=152.1" (141)
16:59:37.231107 IP w-151-210.wfer.ens-paris-saclay.fr.mdns > 224.0.0.251.mdns: 0*- [0q] 2/0/1 PTR MacBook Pro de martin._companion-link._tcp.local., (Cache flush) TXT "rpBA=48:1C:13:90:83:4F" "rpAD=2d0b72822d99" "rpFl=0x20000" "rpHN=e5f10811289c" "rpMac=0" "rpVr=260.3" (198)
16:59:37.231485 IP w-152-39.wfer.ens-paris-saclay.fr.mdns > 224.0.0.251.mdns: 0*- [0q] 2/0/0 TXT "model=MacBookPro13,2" "osxvers=18" "ecolor=225,225,223", PTR MacBook Cedric._companion-link._tcp.local. (158)
16:59:37.231874 IP w-153-135.wfer.ens-paris-saclay.fr.mdns > 224.0.0.251.mdns: 0*- [0q] 2/0/0 PTR mbk-11-53 (2)._companion-link._tcp.local., TXT "model=MacBookPro12,1" "osxvers=20" (137)
16:59:37.232918 IP w-146-251.wfer.ens-paris-saclay.fr.49669 > 239.255.255.250.ws-discovery: UDP, length 656
16:59:37.233147 IP w-154-251.wfer.ens-paris-saclay.fr.mdns > 224.0.0.251.mdns: 0*- [0q] 1/0/0 (Cache flush) A 138.231.154.251 (49)
16:59:37.233510 IP w-150-222.wfer.ens-paris-saclay.fr.mdns > 224.0.0.251.mdns: 0*- [0q] 2/0/0 PTR MacBook Pro de Zhou._companion-link._tcp.local., TXT "model=MacBookPro9,2" "osxvers=19" (148)
16:59:37.233954 IP w-144-150.wfer.ens-paris-saclay.fr.mdns > 224.0.0.251.mdns: 0 [1a] [8q] [1au] PTR (QU)? _companion-link._tcp.local. PTR (QU)? _hap._tcp.local. PTR (QU)? _hap._udp.local. PTR (QU)? _homekit._tcp.local. PTR (QU)? _airplay._tcp.local. PTR (QU)? _raop._tcp.local. PTR (QU)? _sleep-proxy._udp.local. TXT (QU)? MacBook Pro de Myriam (2)._companion-link._tcp.local. (207)
16:59:37.234349 IP w-154-60.wfer.ens-paris-saclay.fr.mdns > 224.0.0.251.mdns: 0*- [0q] 2/0/0 PTR Susannes MacBook Pro._companion-link._tcp.local., TXT "model=MacBookPro16,2" "osxvers=20" "ecolor=225,225,223" (170)
16:59:37.234808 IP w-144-150.wfer.ens-paris-saclay.fr.mdns > 224.0.0.251.mdns: 0*- [0q] 2/0/3 (Cache flush) PTR iPad-de-Louka.local., (Cache flush) PTR iPad-de-Louka.local. (220)
16:59:37.235163 IP w-154-16.wfer.ens-paris-saclay.fr.mdns > 224.0.0.251.mdns: 0*- [0q] 2/0/0 PTR Ambre._companion-link._tcp.local., TXT "model=MacBookPro15,1" "osxvers=20" "ecolor=157,157,160" (140)
16:59:37.235542 IP w-151-16.wfer.ens-paris-saclay.fr.mdns > 224.0.0.251.mdns: 0*- [0q] 2/0/0 PTR PAB Macbook Pro._companion-link._tcp.local., TXT "model=MacBookPro15,1" "osxvers=21" "ecolor=157,157,160" (160)
16:59:37.235801 IP w-153-120.wfer.ens-paris-saclay.fr.mdns > 224.0.0.251.mdns: 0 [1au] TXT (QU)? MacBook Pro de Karine._companion-link._tcp.local. (95)
16:59:37.236187 IP w-153-243.wfer.ens-paris-saclay.fr.mdns > 224.0.0.251.mdns: 0*- [0q] 2/0/0 PTR MacBook de Baptiste._companion-link._tcp.local., TXT "model=MacBook10,1" "osxvers=17" "ecolor=225,225,223" (165)
16:59:37.331173 IP w-157-99.wfer.ens-paris-saclay.fr.56498 > 239.255.255.250.ssdp: UDP, length 173
16:59:37.331565 IP w-157-99.wfer.ens-paris-saclay.fr.56499 > 239.255.255.250.ssdp: UDP, length 174
16:59:37.332224 IP w-157-241.wfer.ens-paris-saclay.fr.mdns > 224.0.0.251.mdns: 0 [13q] [1au] TXT (QU)? MacBook Pro de Myriam (2)._companion-link._tcp.local. TXT (QU)? Wei de iPad._companion-link._tcp.local. TXT (QU)? PamelaM-bM-^@M-^Ys MacBook Pro._companion-link._tcp.local. TXT (QU)? MARS-07._companion-link._tcp.local. TXT (QU)? JuanM-bM-^@M-^Ys MacBook Pro._companion-link._tcp.local. TXT (QU)? SuperKick._companion-link._tcp.local. TXT (QU)? MacBook Cedric._companion-link._tcp.local. TXT (QU)? mbk-11-53 (2)._companion-link._tcp.local. TXT (QU)? MacBook Pro de Zhou._companion-link._tcp.local. TXT (QU)? Susannes MacBook Pro._companion-link._tcp.local. TXT (QU)? Ambre._companion-link._tcp.local. TXT (QU)? MacBook Air de SM-CM-)bastien._companion-link._tcp.local. TXT (QU)? MacBook Air de Bryan._companion-link._tcp.local. (368)
16:59:37.332601 IP w-154-221.wfer.ens-paris-saclay.fr.mdns > 224.0.0.251.mdns: 0*- [0q] 2/0/0 PTR iPad Pro de Rafael._companion-link._tcp.local., TXT "model=J522AP" (128)
16:59:37.332968 IP w-147-191.wfer.ens-paris-saclay.fr.mdns > 224.0.0.251.mdns: 0*- [0q] 2/0/0 PTR MacBook Air de Dupin._companion-link._tcp.local., TXT "model=MacBookAir7,2" "osxvers=17" (150)
16:59:37.333439 IP w-157-250.wfer.ens-paris-saclay.fr.mdns > 224.0.0.251.mdns: 0*- [0q] 1/0/1 (Cache flush) TXT "rpMac=0" "rpHN=d811c9154d5d" "rpFl=0x20000" "rpHA=a4d66e1f6a4a" "rpVr=310.7.1" "rpAD=5f293fdb01b1" "rpHI=6486ad541055" "rpBA=8C:4D:1C:6F:3C:84" (229)
16:59:37.333706 IP w-158-180.wfer.ens-paris-saclay.fr.mdns > 224.0.0.251.mdns: 0*- [0q] 1/0/0 PTR RoccoM-bM-^@M-^Ys MacBook Air._companion-link._tcp.local. (74)
16:59:37.333973 IP w-151-210.wfer.ens-paris-saclay.fr.mdns > 224.0.0.251.mdns: 0*- [0q] 1/0/0 PTR MacBook Pro de martin._companion-link._tcp.local. (74)
16:59:37.334205 IP w-152-165.wfer.ens-paris-saclay.fr.mdns > 224.0.0.251.mdns: 0*- [0q] 1/0/0 (Cache flush) A 138.231.152.165 (49)
16:59:37.334547 IP w-159-242.wfer.ens-paris-saclay.fr.db-lsp-disc > 255.255.255.255.db-lsp-disc: UDP, length 132
16:59:37.334890 IP w-159-242.wfer.ens-paris-saclay.fr.db-lsp-disc > 255.255.255.255.db-lsp-disc: UDP, length 132
16:59:37.335234 IP w-159-242.wfer.ens-paris-saclay.fr.db-lsp-disc > 255.255.255.255.db-lsp-disc: UDP, length 132
16:59:37.335637 IP w-147-118.wfer.ens-paris-saclay.fr.mdns > 224.0.0.251.mdns: 0 [6q] [1au] TXT (QU)? MacBook Pro de Myriam (2)._companion-link._tcp.local. TXT (QU)? MacBook Cedric._companion-link._tcp.local. TXT (QU)? mbk-11-53 (2)._companion-link._tcp.local. TXT (QU)? MacBook Pro de Zhou._companion-link._tcp.local. TXT (QU)? Susannes MacBook Pro._companion-link._tcp.local. TXT (QU)? Ambre._companion-link._tcp.local. (205)
16:59:37.335979 IP w-159-242.wfer.ens-paris-saclay.fr.db-lsp-disc > 255.255.255.255.db-lsp-disc: UDP, length 132
16:59:37.336692 IP w-152-32.wfer.ens-paris-saclay.fr.mdns > 224.0.0.251.mdns: 0*- [0q] 2/0/6 PTR MacBook Pro de Benedikt._companion-link._tcp.local., TXT "model=MacBookPro16,1" "osxvers=20" "ecolor=225,225,223" (408)
16:59:37.337032 IP w-159-242.wfer.ens-paris-saclay.fr.db-lsp-disc > 138.231.159.255.db-lsp-disc: UDP, length 132
16:59:37.339139 IP w-144-111.wfer.ens-paris-saclay.fr.mdns > 224.0.0.251.mdns: 0 [b2&3=0x200] [41a] [1au] PTR (QM)? _companion-link._tcp.local. (1452)
16:59:37.339538 IP w-150-65.wfer.ens-paris-saclay.fr.mdns > 224.0.0.251.mdns: 0*- [0q] 2/0/0 PTR MathiasM-bM-^@M-^Ys MacBook Pro._companion-link._tcp.local., TXT "model=MacBookPro13,1" "osxvers=20" "ecolor=157,157,160" (176)
16:59:37.340129 IP w-144-111.wfer.ens-paris-saclay.fr.mdns > 224.0.0.251.mdns: 0 [8a] [0q] [1au] (319)
16:59:37.340513 IP w-155-229.wfer.ens-paris-saclay.fr.mdns > 224.0.0.251.mdns: 0*- [0q] 2/0/0 PTR maconeM-bM-^@M-^Ys MacBook Pro (2)._companion-link._tcp.local., TXT "model=MacBookPro12,1" "osxvers=17" (163)
16:59:37.340800 IP w-144-111.wfer.ens-paris-saclay.fr.mdns > 224.0.0.251.mdns: 0 [2q] [1au] PTR (QM)? _homekit._tcp.local. PTR (QM)? _sleep-proxy._udp.local. (90)
16:59:37.341217 IP w-151-31.wfer.ens-paris-saclay.fr.mdns > 224.0.0.251.mdns: 0*- [0q] 2/0/0 PTR MacBook Air de Ngoc Diep Lai._companion-link._tcp.local., TXT "model=MacBookPro14,2" "osxvers=20" "ecolor=157,157,160" (186)
16:59:37.341562 IP w-144-150.wfer.ens-paris-saclay.fr.mdns > 224.0.0.251.mdns: 0 [3q] [1au] TXT (QU)? MacBook Cedric._companion-link._tcp.local. TXT (QU)? mbk-11-53 (2)._companion-link._tcp.local. TXT (QU)? MacBook Pro de Zhou._companion-link._tcp.local. (134)
16:59:37.341929 IP w-149-151.wfer.ens-paris-saclay.fr.mdns > 224.0.0.251.mdns: 0*- [0q] 2/0/0 PTR JuanM-bM-^@M-^Ys MacBook Pro._companion-link._tcp.local., TXT "model=MacBookPro12,1" "osxvers=21" (151)
16:59:37.342255 IP w-155-103.wfer.ens-paris-saclay.fr.mdns > 224.0.0.251.mdns: 0*- [0q] 2/0/0 PTR iPad de Anissa._companion-link._tcp.local., TXT "model=J317AP" (120)
16:59:37.342672 IP w-155-23.wfer.ens-paris-saclay.fr.mdns > 224.0.0.251.mdns: 0*- [0q] 2/0/0 PTR MacBook Air cM-aM-;M-'a Do._companion-link._tcp.local., TXT "model=MacBookAir10,1" "osxvers=20" "icolor=1" (160)
16:59:37.433525 IP w-147-173.wfer.ens-paris-saclay.fr.mdns > 224.0.0.251.mdns: 0*- [0q] 2/0/0 PTR SuperKick._companion-link._tcp.local., TXT "model=MacBookPro15,2" "osxvers=20" "ecolor=225,225,223" (148)
16:59:37.433938 IP w-154-16.wfer.ens-paris-saclay.fr.mdns > 224.0.0.251.mdns: 0*- [0q] 1/0/1 (Cache flush) TXT "rpBA=C6:55:B9:62:74:C7" "rpAD=7cc7b0f7cf17" "rpFl=0x20000" "rpHN=6ab250ab7a05" "rpMac=0" "rpVr=260.3" (168)
16:59:37.434316 IP w-154-196.wfer.ens-paris-saclay.fr.mdns > 224.0.0.251.mdns: 0*- [0q] 2/0/0 PTR MacBook Air de Anna._companion-link._tcp.local., TXT "model=MacBookAir10,1" "osxvers=20" "icolor=1" (158)
16:59:37.435129 IP w-157-103.wfer.ens-paris-saclay.fr.mdns > 224.0.0.251.mdns: 0*- [0q] 9/0/5 (Cache flush) TXT "", PTR _apple-mobdev2._tcp.local., PTR 84:ab:1a:0a:40:3d@fe80::86ab:1aff:fe0a:403d._apple-mobdev2._tcp.local., PTR 84:ab:1a:0a:40:3d@fe80::86ab:1aff:fe0a:403d._apple-mobdev2._tcp.local., (Cache flush) PTR iPhone-de-Lila.local., (Cache flush) PTR iPhone-de-Lila.local., (Cache flush) SRV iPhone-de-Lila.local.:32498 0 0, (Cache flush) AAAA fe80::145b:12cc:af01:ad91, (Cache flush) A 138.231.157.103 (482)
16:59:37.435411 IP w-157-108.wfer.ens-paris-saclay.fr.mdns > 224.0.0.251.mdns: 0 [2q] [1au] PTR (QM)? lb._dns-sd._udp.local. PTR (QM)? _homekit._tcp.local. (88)
16:59:37.435782 IP w-154-204.wfer.ens-paris-saclay.fr.mdns > 224.0.0.251.mdns: 0*- [0q] 2/0/1 PTR iPad de Patricia._companion-link._tcp.local., TXT "model=J420AP" (153)
16:59:37.436093 IP w-148-42.wfer.ens-paris-saclay.fr.mdns > 224.0.0.251.mdns: 0*- [0q] 2/0/0 PTR iPad (3)._companion-link._tcp.local., TXT "model=J307AP" (108)
16:59:37.438179 IP w-157-108.wfer.ens-paris-saclay.fr.mdns > 224.0.0.251.mdns: 0 [b2&3=0x200] [42a] [1au] PTR (QM)? _companion-link._tcp.local. (1437)
16:59:37.438915 IP w-158-7.wfer.ens-paris-saclay.fr.mdns > 224.0.0.251.mdns: 0*- [0q] 3/0/5 TXT "model=MacBookPro17,1" "osxvers=20" "icolor=2", (Cache flush) TXT "rpMac=0" "rpHN=4ef8517f0790" "rpFl=0x20000" "rpHA=de8157bf3f9e" "rpVr=260.3" "rpAD=17a4c2ad0d1f" "rpHI=7728f4ec3506" "rpBA=20:43:5A:29:37:08", PTR xuyangM-bM-^@M-^Ys MacBook Pro._companion-link._tcp.local. (428)
16:59:37.439526 IP w-157-108.wfer.ens-paris-saclay.fr.mdns > 224.0.0.251.mdns: 0 [7a] [0q] [1au] (334)
16:59:37.440037 IP w-151-161.wfer.ens-paris-saclay.fr.mdns > 224.0.0.251.mdns: 0*- [0q] 3/0/1 (Cache flush) TXT "rpBA=75:89:CE:8B:81:32" "rpAD=9b918a11904c" "rpFl=0x20000" "rpHN=8c0c6bd0a6b8" "rpVr=174.23", PTR MacBook Air (5)._companion-link._tcp.local., TXT "model=MacBookAir7,2" "osxvers=18" (257)
16:59:37.440412 IP w-145-123.wfer.ens-paris-saclay.fr.mdns > 224.0.0.251.mdns: 0*- [0q] 2/0/0 PTR MacBook Air de Isabelle._companion-link._tcp.local., TXT "model=MacBookAir7,2" "osxvers=21" (156)
16:59:37.440643 IP w-151-210.wfer.ens-paris-saclay.fr.mdns > 224.0.0.251.mdns: 0*- [0q] 1/0/0 PTR MacBook Pro de martin._companion-link._tcp.local. (74)
16:59:37.440984 IP w-159-164.wfer.ens-paris-saclay.fr.mdns > 224.0.0.251.mdns: 0*- [0q] 2/0/0 PTR MARS-07._companion-link._tcp.local., TXT "model=iMac17,1" "osxvers=18" (119)
16:59:37.441248 IP w-147-27.wfer.ens-paris-saclay.fr.mdns > 224.0.0.251.mdns: 0 [2q] [2n] ANY (QU)? Android-75.local. ANY (QU)? Android-75.local. (84)
16:59:37.441866 IP w-148-105.wfer.ens-paris-saclay.fr.mdns > 224.0.0.251.mdns: 0*- [0q] 3/0/1 (Cache flush) TXT "rpMac=0" "rpHN=fb8705d614f8" "rpFl=0x20000" "rpHA=0ec925ccadc1" "rpVr=260.3" "rpAD=a5d95e018dac" "rpHI=f95ac798bcb0" "rpBA=75:81:66:C8:3A:E5", PTR MacBook Pro de Myriam (2)._companion-link._tcp.local., TXT "model=MacBookPro15,4" "osxvers=20" "ecolor=157,157,160" (340)
16:59:37.442401 IP w-146-47.wfer.ens-paris-saclay.fr.mdns > 224.0.0.251.mdns: 0*- [0q] 3/0/1 TXT "model=MacBookPro11,3" "osxvers=20", (Cache flush) TXT "rpBA=83:21:AD:25:FE:26" "rpAD=7b4fe71a9822" "rpFl=0x20000" "rpHN=d719897364de" "rpMac=0" "rpVr=260.3", PTR MacBookPro-FTreussart._companion-link._tcp.local. (277)
16:59:37.442693 IP w-153-184.wfer.ens-paris-saclay.fr.mdns > 224.0.0.251.mdns: 0*- [0q] 2/0/0 PTR sarlat._airplay._tcp.local., PTR 38F9D30DE38D@sarlat._raop._tcp.local. (92)
16:59:37.442908 IP w-155-228.wfer.ens-paris-saclay.fr.mdns > 224.0.0.251.mdns: 0 PTR (QM)? _ni-slsc._tcp.local. (37)
16:59:37.443331 IP w-147-198.wfer.ens-paris-saclay.fr.mdns > 224.0.0.251.mdns: 0*- [0q] 2/0/1 PTR MacBook Air de Perrot._companion-link._tcp.local., TXT "model=MacBookAir10,1" "osxvers=20" "icolor=2" (191)
16:59:37.443687 IP w-145-139.wfer.ens-paris-saclay.fr.mdns > 224.0.0.251.mdns: 0*- [0q] 2/0/0 PTR Wei de iPad._companion-link._tcp.local., TXT "model=J307AP" (114)
16:59:37.443923 IP w-147-119.wfer.ens-paris-saclay.fr.netbios-ns > 138.231.159.255.netbios-ns: UDP, length 50
16:59:37.444341 IP w-144-150.wfer.ens-paris-saclay.fr.mdns > 224.0.0.251.mdns: 0 [5q] [1au] TXT (QU)? Susannes MacBook Pro._companion-link._tcp.local. TXT (QU)? Ambre._companion-link._tcp.local. TXT (QU)? iPad Pro de Rafael._companion-link._tcp.local. TXT (QU)? MacBook Air de Dupin._companion-link._tcp.local. TXT (QU)? MathiasM-bM-^@M-^Ys MacBook Pro._companion-link._tcp.local. (188)
16:59:37.444737 IP w-152-198.wfer.ens-paris-saclay.fr.mdns > 224.0.0.251.mdns: 0*- [0q] 2/0/0 PTR MacBook Pro de Issam._companion-link._tcp.local., TXT "model=MacBookPro15,4" "osxvers=20" "ecolor=157,157,160" (170)
16:59:37.445236 IP w-152-39.wfer.ens-paris-saclay.fr.mdns > 224.0.0.251.mdns: 0*- [0q] 3/0/1 TXT "model=MacBookPro13,2" "osxvers=18" "ecolor=225,225,223", (Cache flush) TXT "rpBA=86:55:1C:B4:71:FE" "rpAD=4c246ac0c086" "rpFl=0x20000" "rpHN=ae0027d9e619" "rpVr=174.23", PTR MacBook Cedric._companion-link._tcp.local. (275)
16:59:37.445561 IP w-153-120.wfer.ens-paris-saclay.fr.mdns > 224.0.0.251.mdns: 0 [3q] [1au] TXT (QU)? iPad de Patricia._companion-link._tcp.local. TXT (QU)? iPad (3)._companion-link._tcp.local. TXT (QU)? MARS-07._companion-link._tcp.local. (119)
16:59:37.446168 IP w-154-87.wfer.ens-paris-saclay.fr.mdns > 224.0.0.251.mdns: 0*- [0q] 2/0/6 PTR MacBook de Agathe._companion-link._tcp.local., TXT "model=MacBook10,1" "osxvers=17" "ecolor=157,157,160" (330)
16:59:37.536588 IP w-157-222.wfer.ens-paris-saclay.fr.54009 > 239.255.255.250.ws-discovery: UDP, length 656
16:59:37.538693 IP w-155-65.wfer.ens-paris-saclay.fr.mdns > 224.0.0.251.mdns: 0 [b2&3=0x200] [41a] [1au] PTR (QM)? _companion-link._tcp.local. (1451)
16:59:37.539361 IP w-157-241.wfer.ens-paris-saclay.fr.mdns > 224.0.0.251.mdns: 0 [12q] [1au] TXT (QU)? PAB Macbook Pro._companion-link._tcp.local. TXT (QU)? MacBook de Baptiste._companion-link._tcp.local. TXT (QU)? iPad Pro de Rafael._companion-link._tcp.local. TXT (QU)? MacBook Air de Dupin._companion-link._tcp.local. TXT (QU)? MathiasM-bM-^@M-^Ys MacBook Pro._companion-link._tcp.local. TXT (QU)? maconeM-bM-^@M-^Ys MacBook Pro (2)._companion-link._tcp.local. TXT (QU)? MacBook Air de Ngoc Diep Lai._companion-link._tcp.local. TXT (QU)? iPad de Anissa._companion-link._tcp.local. TXT (QU)? MacBook Air cM-aM-;M-'a Do._companion-link._tcp.local. TXT (QU)? MacBook Air de Anna._companion-link._tcp.local. TXT (QU)? iPad de Patricia._companion-link._tcp.local. TXT (QU)? iPad (3)._companion-link._tcp.local. (377)
16:59:37.539957 IP w-155-65.wfer.ens-paris-saclay.fr.mdns > 224.0.0.251.mdns: 0 [8a] [0q] [1au] (320)
16:59:37.540310 IP w-147-23.wfer.ens-paris-saclay.fr.mdns > 224.0.0.251.mdns: 0*- [0q] 2/0/0 PTR MacBook Pro (5)._companion-link._tcp.local., TXT "model=MacBookPro11,5" "osxvers=17" (141)
16:59:37.541330 IP w-151-168.wfer.ens-paris-saclay.fr.mdns > 224.0.0.251.mdns: 0 [16a] [4q] [1au] PTR (QU)? lb._dns-sd._udp.local. PTR (QU)? _companion-link._tcp.local. PTR (QU)? _homekit._tcp.local. PTR (QU)? _sleep-proxy._udp.local. (638)
16:59:37.541733 IP w-146-149.wfer.ens-paris-saclay.fr.mdns > 224.0.0.251.mdns: 0*- [0q] 2/0/1 PTR MacBook Pro de delelis._companion-link._tcp.local., TXT "model=MacBookPro11,4" "osxvers=17" (178)
16:59:37.542192 IP w-155-65.wfer.ens-paris-saclay.fr.mdns > 224.0.0.251.mdns: 0 [6q] [1au] PTR (QM)? _homekit._tcp.local. PTR (QM)? _sleep-proxy._udp.local. TXT (QM)? MacBookPro-FTreussart._companion-link._tcp.local. TXT (QU)? PAB Macbook Pro._companion-link._tcp.local. TXT (QU)? MacBook Air de Ngoc Diep Lai._companion-link._tcp.local. TXT (QU)? MacBook Air cM-aM-;M-'a Do._companion-link._tcp.local. (218)
16:59:37.542587 IP w-151-211.wfer.ens-paris-saclay.fr.mdns > 224.0.0.251.mdns: 0*- [0q] 2/0/0 PTR MacBook Air de Mihaja._companion-link._tcp.local., TXT "model=MacBookAir8,2" "osxvers=19" "ecolor=225,225,223" (171)
16:59:37.542798 IP w-151-45.wfer.ens-paris-saclay.fr.mdns > 224.0.0.251.mdns: 7 [2q] PTR (QM)? _233637DE._sub._googlecast._tcp.local. PTR (QM)? _googlecast._tcp.local. (61)
16:59:37.542991 IP w-154-251.wfer.ens-paris-saclay.fr.58313 > 224.0.0.252.llmnr: UDP, length 22
16:59:37.638276 IP w-158-119.wfer.ens-paris-saclay.fr.64173 > 239.255.255.250.ssdp: UDP, length 174
16:59:37.638491 IP w-158-119.wfer.ens-paris-saclay.fr.mdns > 224.0.0.251.mdns: 0 PTR (QM)? _googlecast._tcp.local. (40)
16:59:37.638935 IP w-159-107.wfer.ens-paris-saclay.fr.mdns > 224.0.0.251.mdns: 0 [4q] [1au] TXT (QU)? MacBook Pro de Zhou._companion-link._tcp.local. TXT (QU)? MathiasM-bM-^@M-^Ys MacBook Pro._companion-link._tcp.local. TXT (QU)? MacBook Air cM-aM-;M-'a Do._companion-link._tcp.local. TXT (QU)? MacBook Pro de delelis._companion-link._tcp.local. (179)
16:59:37.639154 IP w-158-119.wfer.ens-paris-saclay.fr.mdns > 224.0.0.251.mdns: 0 PTR (QM)? _googlecast._tcp.local. (40)
16:59:37.641023 IP w-147-117.wfer.ens-paris-saclay.fr.mdns > 224.0.0.251.mdns: 0 [33a] [12q] [1au] PTR (QU)? _companion-link._tcp.local. PTR (QU)? _homekit._tcp.local. PTR (QU)? _sleep-proxy._udp.local. TXT (QU)? MacBook Cedric._companion-link._tcp.local. TXT (QU)? MacBook Pro de Zhou._companion-link._tcp.local. TXT (QU)? Susannes MacBook Pro._companion-link._tcp.local. TXT (QU)? PAB Macbook Pro._companion-link._tcp.local. TXT (QU)? MacBook de Baptiste._companion-link._tcp.local. TXT (QU)? iPad Pro de Rafael._companion-link._tcp.local. TXT (QU)? MacBook Air de Dupin._companion-link._tcp.local. TXT (QU)? MacBook Pro de martin._companion-link._tcp.local. TXT (QU)? MathiasM-bM-^@M-^Ys MacBook Pro._companion-link._tcp.local. (1268)
16:59:37.641408 IP w-151-200.wfer.ens-paris-saclay.fr.mdns > 224.0.0.251.mdns: 0*- [0q] 2/0/0 PTR MacBook Pro de Karim._companion-link._tcp.local., TXT "model=MacBookPro14,1" "osxvers=19" "ecolor=157,157,160" (170)
16:59:37.642038 IP w-151-168.wfer.ens-paris-saclay.fr.mdns > 224.0.0.251.mdns: 0 [12q] [1au] TXT (QU)? SuperKick._companion-link._tcp.local. TXT (QU)? 38F9D30DE38D@sarlat._raop._tcp.local. TXT (QU)? sarlat._airplay._tcp.local. TXT (QU)? MacBook Air de Anna._companion-link._tcp.local. TXT (QU)? iPad de Patricia._companion-link._tcp.local. TXT (QU)? iPad (3)._companion-link._tcp.local. TXT (QU)? MacBook Pro de martin._companion-link._tcp.local. TXT (QU)? MacBook Air de Isabelle._companion-link._tcp.local. TXT (QU)? MARS-07._companion-link._tcp.local. TXT (QU)? MacBook Air de Perrot._companion-link._tcp.local. TXT (QU)? MacBook Pro de Issam._companion-link._tcp.local. TXT (QU)? Wei de iPad._companion-link._tcp.local. (346)
16:59:37.642346 IP w-153-120.wfer.ens-paris-saclay.fr.mdns > 224.0.0.251.mdns: 0 [2q] [1au] TXT (QM)? mbk-11-53 (2)._companion-link._tcp.local. TXT (QM)? port-mguillard._companion-link._tcp.local. (108)
16:59:37.643030 IP w-147-117.wfer.ens-paris-saclay.fr.mdns > 224.0.0.251.mdns: 0 [13q] [1au] TXT (QU)? maconeM-bM-^@M-^Ys MacBook Pro (2)._companion-link._tcp.local. TXT (QU)? MacBook Air de Ngoc Diep Lai._companion-link._tcp.local. TXT (QU)? JuanM-bM-^@M-^Ys MacBook Pro._companion-link._tcp.local. TXT (QU)? iPad de Anissa._companion-link._tcp.local. TXT (QU)? MacBook Air cM-aM-;M-'a Do._companion-link._tcp.local. TXT (QU)? SuperKick._companion-link._tcp.local. TXT (QU)? MacBook Air de Anna._companion-link._tcp.local. TXT (QU)? iPad de Patricia._companion-link._tcp.local. TXT (QU)? iPad (3)._companion-link._tcp.local. TXT (QU)? MARS-07._companion-link._tcp.local. TXT (QU)? sarlat._airplay._tcp.local. TXT (QU)? 38F9D30DE38D@sarlat._raop._tcp.local. TXT (QU)? MacBook Air de Perrot._companion-link._tcp.local. (386)
16:59:37.643364 IP w-147-51.wfer.ens-paris-saclay.fr.54578 > 239.255.255.250.ssdp: UDP, length 125
16:59:37.643775 IP w-155-23.wfer.ens-paris-saclay.fr.mdns > 224.0.0.251.mdns: 0*- [0q] 1/0/1 (Cache flush) TXT "rpBA=B6:C2:B5:FC:72:79" "rpAD=9adcb0169c2f" "rpFl=0x20000" "rpHN=22084fbc7006" "rpMac=0" "rpVr=260.3" (183)
16:59:37.644491 IP w-147-201.wfer.ens-paris-saclay.fr.mdns > 224.0.0.251.mdns: 0 [15q] [1au] TXT (QU)? MacBook Pro de Zhou._companion-link._tcp.local. TXT (QU)? Susannes MacBook Pro._companion-link._tcp.local. TXT (QU)? Ambre._companion-link._tcp.local. TXT (QU)? PAB Macbook Pro._companion-link._tcp.local. TXT (QU)? MacBook de Baptiste._companion-link._tcp.local. TXT (QU)? iPad Pro de Rafael._companion-link._tcp.local. TXT (QU)? sarlat._airplay._tcp.local. TXT (QU)? 38F9D30DE38D@sarlat._raop._tcp.local. TXT (QU)? iPad de Patricia._companion-link._tcp.local. TXT (QU)? iPad (3)._companion-link._tcp.local. TXT (QU)? MacBook Pro de martin._companion-link._tcp.local. TXT (QU)? MARS-07._companion-link._tcp.local. TXT (QU)? MacBook Air de Perrot._companion-link._tcp.local. TXT (QU)? Wei de iPad._companion-link._tcp.local. TXT (QU)? MacBook Pro de Issam._companion-link._tcp.local. (412)
16:59:37.644702 IP w-151-245.wfer.ens-paris-saclay.fr.mdns > 224.0.0.251.mdns: 0 A (QM)? urjoweojvl.local. (34)
16:59:37.644913 IP w-151-245.wfer.ens-paris-saclay.fr.mdns > 224.0.0.251.mdns: 0 A (QM)? fmyuqcpokg.local. (34)
16:59:37.645264 IP w-148-68.wfer.ens-paris-saclay.fr.mdns > 224.0.0.251.mdns: 0*- [0q] 2/0/0 TXT "model=MacBook8,1" "osxvers=20" "ecolor=157,157,160", PTR MacBook di Federica._companion-link._tcp.local. (164)
16:59:37.645473 IP w-151-245.wfer.ens-paris-saclay.fr.mdns > 224.0.0.251.mdns: 0 A (QM)? touxhtwgg.local. (33)
16:59:37.645676 IP w-151-245.wfer.ens-paris-saclay.fr.58505 > 224.0.0.252.llmnr: UDP, length 28
16:59:37.646131 IP w-151-16.wfer.ens-paris-saclay.fr.mdns > 224.0.0.251.mdns: 0*- [0q] 1/0/1 (Cache flush) TXT "rpMac=0" "rpHN=a66d39a827d3" "rpFl=0x20000" "rpHA=aeb1c39540dc" "rpVr=310.7.1" "rpAD=668080258e67" "rpHI=257a38bbce28" "rpBA=18:ED:0F:44:AE:0C" (216)
16:59:37.646334 IP w-151-245.wfer.ens-paris-saclay.fr.60526 > 224.0.0.252.llmnr: UDP, length 28
16:59:37.646538 IP w-151-245.wfer.ens-paris-saclay.fr.58361 > 224.0.0.252.llmnr: UDP, length 27
16:59:37.646860 IP w-158-240.wfer.ens-paris-saclay.fr.mdns > 224.0.0.251.mdns: 0*- [0q] 2/0/0 PTR iPad de Malo._companion-link._tcp.local., TXT "model=J207AP" (116)
16:59:37.648043 IP w-147-251.wfer.ens-paris-saclay.fr.62959 > 239.255.255.250.ws-discovery: UDP, length 656
16:59:37.722500 IP ArnaudPortable.42009 > dns.ens-cachan.fr.domain: 50466+ PTR? 251.0.0.224.in-addr.arpa. (42)
16:59:37.724389 IP dns.ens-cachan.fr.domain > ArnaudPortable.42009: 50466 NXDomain 0/1/0 (99)
16:59:37.724665 IP ArnaudPortable.52396 > dns.ens-cachan.fr.domain: 30158+ PTR? 107.159.231.138.in-addr.arpa. (46)
16:59:37.726383 IP dns.ens-cachan.fr.domain > ArnaudPortable.52396: 30158* 1/2/2 PTR w-159-107.wfer.ens-paris-saclay.fr. (169)
16:59:37.726698 IP ArnaudPortable.46803 > dns.ens-cachan.fr.domain: 27943+ PTR? 165.152.231.138.in-addr.arpa. (46)
16:59:37.728402 IP dns.ens-cachan.fr.domain > ArnaudPortable.46803: 27943* 1/2/2 PTR w-152-165.wfer.ens-paris-saclay.fr. (169)
